{
  "$schema": "https://json-schema.org/draft/2020-12/schema",
  "$id": "https://vc4qi.example/schemas/cal/1/certificate.json",
  "title": "Calibration certificate (DCC)",
  "description": "Experimental VC4QI calibration binding v1 fixture schema. Not an external standard.",
  "type": "object",
  "required": [
    "@context",
    "id",
    "type",
    "issuer",
    "validFrom",
    "validUntil",
    "credentialSchema",
    "credentialSubject",
    "credentialStatus",
    "relatedResource"
  ],
  "properties": {
    "@context": {
      "const": [
        "https://www.w3.org/ns/credentials/v2",
        "https://vc4qi.example/contexts/cal/1"
      ]
    },
    "id": {
      "type": "string",
      "format": "uri"
    },
    "type": {
      "const": [
        "VerifiableCredential",
        "CalCertificate"
      ]
    },
    "issuer": {
      "type": "string",
      "format": "uri"
    },
    "validFrom": {
      "type": "string",
      "pattern": "^\\d{4}-\\d{2}-\\d{2}T\\d{2}:\\d{2}:\\d{2}(\\.\\d{1,9})?(Z|[+-]\\d{2}:\\d{2})$"
    },
    "validUntil": {
      "type": "string",
      "pattern": "^\\d{4}-\\d{2}-\\d{2}T\\d{2}:\\d{2}:\\d{2}(\\.\\d{1,9})?(Z|[+-]\\d{2}:\\d{2})$"
    },
    "credentialSchema": {
      "type": "object",
      "required": [
        "id",
        "type"
      ],
      "properties": {
        "id": {
          "const": "https://vc4qi.example/schemas/cal/1/certificate.json"
        },
        "type": {
          "const": "JsonSchema"
        }
      },
      "additionalProperties": false
    },
    "credentialSubject": {
      "type": "object",
      "required": [
        "id",
        "activityTime",
        "measurementGroups"
      ],
      "properties": {
        "id": {
          "type": "string",
          "format": "uri"
        },
        "activityTime": {
          "type": "string",
          "pattern": "^\\d{4}-\\d{2}-\\d{2}T\\d{2}:\\d{2}:\\d{2}(\\.\\d{1,9})?(Z|[+-]\\d{2}:\\d{2})$"
        },
        "measurementGroups": {
          "type": "array",
          "minItems": 1,
          "items": {
            "type": "object",
            "required": [
              "id",
              "quantityKindIri",
              "results"
            ],
            "properties": {
              "id": {
                "type": "string",
                "format": "uri"
              },
              "quantityKindIri": {
                "type": "string",
                "format": "uri"
              },
              "methodIris": {
                "type": "array",
                "uniqueItems": true,
                "items": {
                  "type": "string",
                  "format": "uri"
                }
              },
              "results": {
                "type": "array",
                "minItems": 1,
                "items": {
                  "type": "object",
                  "required": [
                    "value",
                    "unit",
                    "expandedUncertainty",
                    "coverageFactor"
                  ],
                  "properties": {
                    "value": {
                      "type": "string",
                      "pattern": "^(0|[1-9][0-9]*)(\\.[0-9]+)?$"
                    },
                    "unit": {
                      "enum": [
                        "Pa",
                        "kPa",
                        "MPa"
                      ]
                    },
                    "expandedUncertainty": {
                      "type": "string",
                      "pattern": "^(0|[1-9][0-9]*)(\\.[0-9]+)?$"
                    },
                    "coverageFactor": {
                      "type": "string",
                      "pattern": "^(0|[1-9][0-9]*)(\\.[0-9]+)?$"
                    }
                  },
                  "additionalProperties": false
                }
              }
            },
            "additionalProperties": false
          }
        }
      },
      "additionalProperties": false
    },
    "termsOfUse": {
      "type": "array",
      "minItems": 1,
      "maxItems": 2,
      "items": {
        "type": "object",
        "required": [
          "type",
          "authorizationCredential"
        ],
        "properties": {
          "type": {
            "const": "CalAuthorizationPolicy"
          },
          "authorizationCredential": {
            "type": "object",
            "required": [
              "id",
              "type"
            ],
            "properties": {
              "id": {
                "type": "string",
                "format": "uri"
              },
              "type": {
                "enum": [
                  "CalAccreditation",
                  "CalOperationalScope",
                  "CalLegalMandate"
                ]
              }
            },
            "additionalProperties": false
          }
        },
        "additionalProperties": false
      }
    },
    "relatedResource": {
      "type": "array",
      "minItems": 1,
      "uniqueItems": true,
      "items": {
        "type": "object",
        "required": [
          "id",
          "digestSRI"
        ],
        "properties": {
          "id": {
            "type": "string",
            "format": "uri"
          },
          "digestSRI": {
            "type": "string",
            "pattern": "^sha384-[A-Za-z0-9+/]{64}$"
          }
        },
        "additionalProperties": false
      }
    },
    "credentialStatus": {
      "type": "object",
      "required": [
        "id",
        "type",
        "statusPurpose",
        "statusListIndex",
        "statusListCredential"
      ],
      "properties": {
        "id": {
          "type": "string",
          "format": "uri"
        },
        "type": {
          "const": "BitstringStatusListEntry"
        },
        "statusPurpose": {
          "enum": [
            "revocation",
            "suspension"
          ]
        },
        "statusListIndex": {
          "type": "string",
          "pattern": "^(0|[1-9][0-9]*)$"
        },
        "statusListCredential": {
          "type": "string",
          "format": "uri"
        }
      },
      "additionalProperties": false
    },
    "name": {
      "type": "string",
      "minLength": 1
    },
    "description": {
      "type": "string",
      "minLength": 1
    },
    "proof": {
      "type": "object",
      "required": [
        "type",
        "cryptosuite",
        "proofPurpose",
        "verificationMethod",
        "created",
        "proofValue"
      ],
      "properties": {
        "type": {
          "const": "DataIntegrityProof"
        },
        "cryptosuite": {
          "const": "eddsa-rdfc-2022"
        },
        "proofPurpose": {
          "const": "assertionMethod"
        },
        "verificationMethod": {
          "type": "string",
          "format": "uri"
        },
        "created": {
          "type": "string",
          "pattern": "^\\d{4}-\\d{2}-\\d{2}T\\d{2}:\\d{2}:\\d{2}(\\.\\d{1,9})?(Z|[+-]\\d{2}:\\d{2})$"
        },
        "proofValue": {
          "type": "string",
          "pattern": "^z[1-9A-HJ-NP-Za-km-z]+$"
        }
      },
      "additionalProperties": false
    }
  },
  "additionalProperties": false
}
