{
  "@context": [
    "https://www.w3.org/ns/credentials/v2",
    "https://vc4qi.example/contexts/cal/1"
  ],
  "id": "https://nmi.vc4qi.example/credentials/DCC-N",
  "type": [
    "VerifiableCredential",
    "CalCertificate"
  ],
  "issuer": "https://nmi.vc4qi.example/controller",
  "validFrom": "2026-04-02T00:00:00Z",
  "validUntil": "2028-04-02T00:00:00Z",
  "credentialSchema": {
    "id": "https://vc4qi.example/schemas/cal/1/certificate.json",
    "type": "JsonSchema"
  },
  "credentialSubject": {
    "id": "urn:vc4qi-example:item:transfer-standard-3",
    "activityTime": "2026-04-01T12:00:00Z",
    "measurementGroups": [
      {
        "id": "https://nmi.vc4qi.example/credentials/DCC-N#g1",
        "quantityKindIri": "https://vc4qi.example/bindings/cal/1#Pressure",
        "methodIris": [
          "https://vc4qi.example/bindings/cal/1#PressureBalance"
        ],
        "results": [
          {
            "value": "20",
            "unit": "MPa",
            "expandedUncertainty": "0.4",
            "coverageFactor": "2"
          }
        ]
      }
    ]
  },
  "termsOfUse": [
    {
      "type": "CalAuthorizationPolicy",
      "authorizationCredential": {
        "id": "https://ministry.vc4qi.example/credentials/CAL-M",
        "type": "CalLegalMandate"
      }
    }
  ],
  "relatedResource": [
    {
      "id": "https://ministry.vc4qi.example/credentials/CAL-M",
      "digestSRI": "sha384-daQ/BfjXOWD/lgmmuQtB/lKbNdFQpxCOgTZgAtq/0Dd3jCScNmkSCOUxXj0xe2HY"
    }
  ],
  "credentialStatus": {
    "id": "https://nmi.vc4qi.example/status/cal/1#0",
    "type": "BitstringStatusListEntry",
    "statusPurpose": "revocation",
    "statusListIndex": "0",
    "statusListCredential": "https://nmi.vc4qi.example/status/cal/1"
  },
  "proof": {
    "type": "DataIntegrityProof",
    "cryptosuite": "eddsa-rdfc-2022",
    "proofPurpose": "assertionMethod",
    "verificationMethod": "https://nmi.vc4qi.example/controller#key-1",
    "created": "2026-04-02T00:00:00Z",
    "proofValue": "z3n6e9P87EtpmqsLWMVy9RSNJYb2WtqkPrqxWLTbqdQYCTD8wyN4eNzcAmFJvAd9HBMVT5wZAohBCx3yh6gY5Y3PF"
  }
}
