{
  "@context": [
    "https://www.w3.org/ns/credentials/v2",
    "https://vc4qi.example/contexts/cal/1"
  ],
  "id": "https://lab.vc4qi.example/credentials/DCC-2",
  "type": [
    "VerifiableCredential",
    "CalCertificate"
  ],
  "issuer": "https://lab.vc4qi.example/controller",
  "validFrom": "2026-03-02T00:00:00Z",
  "validUntil": "2028-03-02T00:00:00Z",
  "credentialSchema": {
    "id": "https://vc4qi.example/schemas/cal/1/certificate.json",
    "type": "JsonSchema"
  },
  "credentialSubject": {
    "id": "urn:vc4qi-example:item:pressure-gauge-7",
    "activityTime": "2026-03-01T12:00:00Z",
    "measurementGroups": [
      {
        "id": "https://lab.vc4qi.example/credentials/DCC-2#g1",
        "quantityKindIri": "https://vc4qi.example/bindings/cal/1#Pressure",
        "methodIris": [
          "https://vc4qi.example/bindings/cal/1#PressureComparison"
        ],
        "results": [
          {
            "value": "1000",
            "unit": "kPa",
            "expandedUncertainty": "0.9",
            "coverageFactor": "2"
          }
        ]
      }
    ]
  },
  "termsOfUse": [
    {
      "type": "CalAuthorizationPolicy",
      "authorizationCredential": {
        "id": "https://lab.vc4qi.example/credentials/CAL-O",
        "type": "CalOperationalScope"
      }
    }
  ],
  "relatedResource": [
    {
      "id": "https://lab.vc4qi.example/credentials/CAL-O",
      "digestSRI": "sha384-zxyHyZmvVmWe3gO0PlKjcUkBHdoKJXzgcP/XCdNMlVsYoL0NElMAbi9mbPNk+JW9"
    }
  ],
  "credentialStatus": {
    "id": "https://lab.vc4qi.example/status/cal/1#2",
    "type": "BitstringStatusListEntry",
    "statusPurpose": "revocation",
    "statusListIndex": "2",
    "statusListCredential": "https://lab.vc4qi.example/status/cal/1"
  },
  "proof": {
    "type": "DataIntegrityProof",
    "cryptosuite": "eddsa-rdfc-2022",
    "proofPurpose": "assertionMethod",
    "verificationMethod": "https://lab.vc4qi.example/controller#key-1",
    "created": "2026-03-02T00:00:00Z",
    "proofValue": "z44rPwBX8sxc1cntKHQyxh1MpAF1QCP7tkhTiiW5ZnyWZ7FJ9o9mNHA4RrE9zPS46HyYYnUBg3GpqG4ah3h7gPUxb"
  }
}
