{
  "@context": [
    "https://www.w3.org/ns/credentials/v2",
    "https://vc4qi.example/contexts/cal/1"
  ],
  "id": "https://lab.vc4qi.example/credentials/DCC-1",
  "type": [
    "VerifiableCredential",
    "CalCertificate"
  ],
  "issuer": "https://lab.vc4qi.example/controller",
  "validFrom": "2026-01-15T00:00:00Z",
  "validUntil": "2028-01-15T00:00:00Z",
  "credentialSchema": {
    "id": "https://vc4qi.example/schemas/cal/1/certificate.json",
    "type": "JsonSchema"
  },
  "credentialSubject": {
    "id": "urn:vc4qi-example:item:pressure-transmitter-1",
    "activityTime": "2026-01-14T12:00:00Z",
    "measurementGroups": [
      {
        "id": "https://lab.vc4qi.example/credentials/DCC-1#g1",
        "quantityKindIri": "https://vc4qi.example/bindings/cal/1#Pressure",
        "methodIris": [
          "https://vc4qi.example/bindings/cal/1#PressureComparison"
        ],
        "results": [
          {
            "value": "1000",
            "unit": "kPa",
            "expandedUncertainty": "0.8",
            "coverageFactor": "2"
          }
        ]
      },
      {
        "id": "https://lab.vc4qi.example/credentials/DCC-1#g2",
        "quantityKindIri": "https://vc4qi.example/bindings/cal/1#Pressure",
        "methodIris": [
          "https://vc4qi.example/bindings/cal/1#PressureComparison"
        ],
        "results": [
          {
            "value": "5",
            "unit": "MPa",
            "expandedUncertainty": "0.002",
            "coverageFactor": "2"
          }
        ]
      }
    ]
  },
  "termsOfUse": [
    {
      "type": "CalAuthorizationPolicy",
      "authorizationCredential": {
        "id": "https://nab.vc4qi.example/credentials/CAL-A",
        "type": "CalAccreditation"
      }
    }
  ],
  "relatedResource": [
    {
      "id": "https://nab.vc4qi.example/credentials/CAL-A",
      "digestSRI": "sha384-YVA8s1tooesmrhniZbMag3VrPyJ0clZRLz9CkHx3xVKk3zHmjPRgnEPbE3JqNXj5"
    }
  ],
  "credentialStatus": {
    "id": "https://lab.vc4qi.example/status/cal/1#0",
    "type": "BitstringStatusListEntry",
    "statusPurpose": "revocation",
    "statusListIndex": "0",
    "statusListCredential": "https://lab.vc4qi.example/status/cal/1"
  },
  "proof": {
    "type": "DataIntegrityProof",
    "cryptosuite": "eddsa-rdfc-2022",
    "proofPurpose": "assertionMethod",
    "verificationMethod": "https://lab.vc4qi.example/controller#key-1",
    "created": "2026-01-15T00:00:00Z",
    "proofValue": "zbyayrcdXGnxcZaN8sdEKwNFVTHKYVRSfPCGqJ3S8qiqa38krvBvMiM25A2RgUxvAbcRhe3gQ3cKYs8ufP8HcLmD"
  }
}
